### ISSUE TITLE
Disable TX ip checksum offload in VMware ESXi 5.5.0 Update 2 

### ISSUE THREAD

**Issue by vincentmli** [F-Stack/f-stack#520]
Just file an issue to track this, while running F-Stack Nginx in VM in VMware ESXi 5.5.0 Update 2, the TX ip checksum offload is enabled by default, but the the ip checksum is not calculated in the hardware, result in ip checksum value 0

<pre>
# tcpdump -nn  -v -r /tmp/cpu0_0.pcap  host 10.1.72.28 and tcp | head -4

SYN from client 10.1.72.28  to  F-Stack Nginx server 10.1.72.168

23:06:37.104023 IP (tos 0x0, ttl 64, id 0, offset 0, flags [DF], proto TCP (6), length 60)
    10.1.72.28.1025 > 10.1.72.168.80: Flags [S], cksum 0xd9ce (correct), seq 1012484, win 14600, options [mss 1460,sackOK,TS val 2692380804 ecr 0,nop,wscale 7], length 0

SYN+ACK from F-Stack Nginx server 10.1.72.168 to client, the ip checksum is 0, and dropped by client.

23:06:37.104023 IP (tos 0x0, ttl 64, id 0, offset 0, flags [DF], proto TCP (6), length 60, bad cksum 0 (->95f6)!)
    10.1.72.168.80 > 10.1.72.28.1025: Flags [S.], cksum 0xa4f4 (incorrect -> 0x656f), seq 2977315146, ack 1012485, win 8192, options [mss 1460,nop,wscale 9,sackOK,TS val 237605994 ecr 2692380804], length 0

</pre>

After digging through the code and found tx_csum_offoad_skip config in [dpdk], and https://github.com/F-Stack/f-stack/issues/317 

<pre>

            if (ff_global_cfg.dpdk.tx_csum_offoad_skip == 0) {
                if ((dev_info.tx_offload_capa & DEV_TX_OFFLOAD_IPV4_CKSUM)) {
                    rte_log(RTE_LOG_INFO, RTE_LOGTYPE_USER1, "TX ip checksum offload supported\n");
                    port_conf.txmode.offloads |= DEV_TX_OFFLOAD_IPV4_CKSUM;
                    pconf->hw_features.tx_csum_ip = 1;
                }

                if ((dev_info.tx_offload_capa & DEV_TX_OFFLOAD_UDP_CKSUM) &&
                    (dev_info.tx_offload_capa & DEV_TX_OFFLOAD_TCP_CKSUM)) {
                    rte_log(RTE_LOG_INFO, RTE_LOGTYPE_USER1, "TX TCP&UDP checksum offload supported\n");
                    port_conf.txmode.offloads |= DEV_TX_OFFLOAD_UDP_CKSUM | DEV_TX_OFFLOAD_TCP_CKSUM;
                    pconf->hw_features.tx_csum_l4 = 1;
                }

</pre>

disable ip checksum offload resolves the tcp connection issue, this also affect icmp ping since it is ip packet.

<pre>
tx_csum_offoad_skip=1
</pre>

**Comment by vincentmli** [comment]
I wonder if we can introduce another configuration option to disable TX ip checksum offload only, and keep tcp/udp checksum offload enabled, I did a test with that and it works in VMware ESXi 5.5.0 Update 2 environment.

the SYN+ACK from F-Stack Nginx, no more "bad cksum 0" in the ip header, but keep tcp checksum offload enabled

<pre>
# tcpdump -n -v -r /tmp/cpu0_0.pcap host 10.1.72.28

15:53:16.597155 IP (tos 0x0, ttl 64, id 0, offset 0, flags [DF], proto TCP (6), length 60)
    10.1.72.168.80 > 10.1.72.28.1025: Flags [S.], cksum 0xa4f4 (incorrect -> 0x2b07), seq 1851342229, ack 1012485, win 8192, options [mss 1460,nop,wscale 9,sackOK,TS val 824592216 ecr 2752780346], length 0
</pre>

**Comment by jfb8856606** [comment]
Yes, you can create a pull requeset to F-Stack.

**Comment by jfb8856606** [comment]
The workaround for this issue is to set `tx_csum_offoad_skip=1` in the `[dpdk]` section of `config.ini`, which disables all TX checksum offloading (IP + TCP/UDP). This resolves the problem in VMware and other virtualized environments where the NIC advertises TX checksum offload capability but doesn't actually calculate the checksum.

The finer-grained control suggested by @vincentmli (disable only IP checksum offload while keeping TCP/UDP checksum offload enabled) has not been implemented yet. This would be a welcome contribution — the relevant code is in `lib/ff_dpdk_if.c` around the `tx_csum_offoad_skip` check, and the `hw_features.tx_csum_ip` / `hw_features.tx_csum_l4` fields already exist separately, so the infrastructure for per-layer control is partially in place.

See also #317 for the same root cause.

Keeping this issue open as the finer-grained TX checksum offload control has not been implemented.

**Comment by jfb8856606** [comment]
## Summary

We investigated this issue and implemented the user-suggested fine-grained TX checksum offload control.

### Problem

The current `tx_csum_offoad_skip` is an all-or-nothing switch — setting it to `1` disables **both** IP and L4 (TCP/UDP) TX checksum offload, which is overkill when only the IP layer offload is broken (as in VMware ESXi 5.5.0 where the virtual NIC claims support but doesn't compute IP checksum).

### Fix

Added two new config options in `config.ini` `[dpdk]` section:

| Option | Default | Effect |
|--------|---------|--------|
| `tx_csum_ip_skip` | 0 | `=1` disables only IP-layer TX checksum offload |
| `tx_csum_l4_skip` | 0 | `=1` disables only L4 (TCP/UDP) TX checksum offload |

**Backward compatible**: `tx_csum_offoad_skip=1` still disables all TX checksum offload; `=0` (default) still enables all.

**VMware workaround**: Set `tx_csum_ip_skip=1` (with `tx_csum_offoad_skip=0`) to disable only IP-layer offload while keeping L4 offload active.

### Additional Fix

Found and fixed a missing `hw_features.tx_csum_ip` guard in the TX path:
- `ff_dpdk_if.c`: IP checksum offload in both regular TX and TSO paths was not guarded by `hw_features.tx_csum_ip` (L4 path correctly had `hw_features.tx_csum_l4` guard)
- `ff_memory.c`: Same fix applied for symmetry
- TSO warning condition updated to also check `tx_csum_ip_skip` and `tx_csum_l4_skip`

### Test Results

Tested on F-Stack 1.26 + FreeBSD 15.0 + DPDK 24.11.6 with virtio NIC:

| Test | Config | TCP Connect | IP Checksum | TCP Checksum | Result |
|------|--------|-------------|-------------|--------------|--------|
| T1 | Default (skip=0) | ✅ | ✅ correct | ✅ correct | PASS |
| T2 | skip=1 | ✅ | ✅ correct (software) | ✅ correct (software) | PASS |
| T3 | ip_skip=1 | ✅ | ✅ correct (software) | ✅ correct | PASS |

Verified with `tcpdump -v`: all F-Stack server packets (SYN-ACK, ACK, data, FIN-ACK) show correct IP and TCP checksums across all three configurations.

### Modified Files

- `lib/ff_config.h`: New `tx_csum_ip_skip` / `tx_csum_l4_skip` fields
- `lib/ff_config.c`: New config parsing branches
- `lib/ff_dpdk_if.c`: Split IP/L4 enable conditions + TX/TSO path IP guard + TSO warning
- `lib/ff_memory.c`: TX/TSO path IP guard
- `config.ini`: New config option documentation

### Note

The virtio NIC in our test environment does not support TX checksum offload (FreeBSD computes all checksums in software), so we could not directly reproduce the VMware scenario. VMware users should verify `tx_csum_ip_skip=1` in their actual environment. Detailed analysis: `docs/issue_520/zh_cn/`.
