### ISSUE TITLE
how to make f-stack use pool of source ips in round robin

### ISSUE THREAD

**Issue by vincentmli** [F-Stack/f-stack#95]
Hi

when use f-stack nginx with proxy_pass, how to make f-stack use pool of source ips in round robin ?

for example I have two dpdk port with ip config as below, f-stack-0 has two ip addresses 10.8.8.2, 10.8.8.3

<pre>
packet flow direction:

(linux client)[10.9.9.3] <--->[10.9.9.2<--->10.8.8.(2-3)](F-Stack)<-->10.8.8.8(BIGIP)

root@compute1:/home/vincent/f-stack# ./tools/ifconfig/ifconfig
lo0: flags=8008<LOOPBACK,MULTICAST> metric 0 mtu 16384
        options=600003<RXCSUM,TXCSUM,RXCSUM_IPV6,TXCSUM_IPV6>
        groups: lo
f-stack-0: flags=8843<UP,BROADCAST,RUNNING,SIMPLEX,MULTICAST> metric 0 mtu 1500
        options=3<RXCSUM,TXCSUM>
        ether 90:e2:ba:93:26:c
        inet 10.8.8.2 netmask 0xffff0000 broadcast 10.8.255.255
        inet 10.8.8.3 netmask 0xffff0000 broadcast 10.8.255.255
f-stack-1: flags=8843<UP,BROADCAST,RUNNING,SIMPLEX,MULTICAST> metric 0 mtu 1500
        options=3<RXCSUM,TXCSUM>
        ether 90:e2:ba:93:26:e
        inet 10.9.9.2 netmask 0xffff0000 broadcast 10.9.255.255

nginx with proxy_pass as:

    upstream bigip_vs {
        server 10.8.8.8:80;
   }

  server { # simple load balancing
    listen          80;
    server_name     bigip_vs;
    access_log      logs/bigip_vs.access.log main;

    location / {
      proxy_pass      http://bigip_vs;
    }
   }

1, run curl to request 10.9.9.2 on linux client

#while true; do curl http://10.9.9.2/; done

2, tcpdump on BIGIP

 # tcpdump -nn  "tcp[tcpflags] & (tcp-syn) != 0" and dst host 10.8.8.8 -i 0.0  -c 10
tcpdump: verbose output suppressed, use -v or -vv for full protocol decode
listening on 0.0, link-type EN10MB (Ethernet), capture size 96 bytes
16:03:01.681360 IP 10.8.8.2.48239 > 10.8.8.8.80: S 315329977:315329977(0) win 8192 <mss 1460,nop,wscale 9,sackOK,timestamp 1534060 0>
16:03:01.687205 IP 10.8.8.2.48240 > 10.8.8.8.80: S 2789857713:2789857713(0) win 8192 <mss 1460,nop,wscale 9,sackOK,timestamp 1534060 0>
16:03:01.693699 IP 10.8.8.2.48241 > 10.8.8.8.80: S 2746683825:2746683825(0) win 8192 <mss 1460,nop,wscale 9,sackOK,timestamp 1534070 0>
16:03:01.699880 IP 10.8.8.2.48242 > 10.8.8.8.80: S 4203727249:4203727249(0) win 8192 <mss 1460,nop,wscale 9,sackOK,timestamp 1534080 0>
16:03:01.705796 IP 10.8.8.2.48243 > 10.8.8.8.80: S 2045379687:2045379687(0) win 8192 <mss 1460,nop,wscale 9,sackOK,timestamp 1534080 0>
16:03:01.711682 IP 10.8.8.2.48244 > 10.8.8.8.80: S 1320211679:1320211679(0) win 8192 <mss 1460,nop,wscale 9,sackOK,timestamp 1534090 0>
16:03:01.717532 IP 10.8.8.2.48245 > 10.8.8.8.80: S 4068545075:4068545075(0) win 8192 <mss 1460,nop,wscale 9,sackOK,timestamp 1534100 0>
16:03:01.723448 IP 10.8.8.2.48246 > 10.8.8.8.80: S 4275721247:4275721247(0) win 8192 <mss 1460,nop,wscale 9,sackOK,timestamp 1534100 0>
16:03:01.729665 IP 10.8.8.2.48247 > 10.8.8.8.80: S 966972836:966972836(0) win 8192 <mss 1460,nop,wscale 9,sackOK,timestamp 1534110 0>
16:03:01.735468 IP 10.8.8.2.48248 > 10.8.8.8.80: S 3075986035:3075986035(0) win 8192 <mss 1460,nop,wscale 9,sackOK,timestamp 1534110 0>
10 packets captured
10 packets received by filter
0 packets dropped by kernel

</pre>

as you can see, nginx/f-stack always used source ip 10.8.8.2 to connect to server 10.8.8.8:80, alias ip 10.8.8.3 is not used. I suspect the source ip decision is done in F-Stack, I guess to use source ip 10.8.8.2 and 10.8.8.3 in round robin fashion, some code may need to be modified in F-Stack, any pointer for direction on how to achieve that? I used mTCP before and I am able to achieve that with mTCP. this kind of feature is needed when you want to achieve more than 2^16 concurrent connections when use f-stack as client to make millions of connections to server since one single source ip only can have maximum 2^16 connections.

**Comment by whl739** [comment]
When connect to a server, first find out a route to destination,  if we found a route, use the address corresponding to the outgoing interface. It is always the first address of the interface.
For your case, it is always 10.8.8.2. This is FreeBSD's default behavior.

If you want to use round robin, you should modify `in_pcbladdr` in freebsd/netinet/in_pcb.c.
