### ISSUE TITLE
Can f-stack support bonding?

### ISSUE THREAD

**Issue by phantomgps** [F-Stack/f-stack#36]
I have a  Intel 82599 NIC with  2 ports, I configured 2 IP address in config.ini， but only one was actived(in the smae LAN), so, how can I config these 2 interface to  be bonding to one interface?

**Comment by whl739** [comment]
F-Stack don't support bonding for now.

Your issuse may be fixed by the last commit d5f5b02c2e1f3401e785e3ef75fac4363e9dcc91.

But there is still an issue here:
The second(port1) setting of gateway will be failed.Because currently a default routing(dst:0.0.0.0) will be setted on each port when f-stack starts, but FreeBSD only allows one default routing.This will be fixed in the future.
If these 2 IP addresses are in the same LAN,  this may not be affected.

**Comment by phantomgps** [comment]
I tried the latest code and rebuild DPDK/f-stack/nginx, restart nginx with 2 ports,  result seems the same as before,  only port0 can get a ping reply.


port0 IP:10.3.31.210  ping OK
port1 IP: 10.3.31.211 ping NG
ping from 10.3.31.42

here is the port1.pcap:
reading from file port1.pcap, link-type EN10MB (Ethernet)
10:05:02.067306 ARP, Request who-has 10.3.31.211 tell 10.3.31.211, length 28
10:05:05.548747 ARP, Request who-has 10.3.31.211 tell 10.3.31.211, length 28
**... repeat arp request ...**
...
10:05:19.209334 IP 10.3.31.42 > 10.3.31.211: ICMP echo request, id 35139, seq 5, length 64
10:05:20.209323 IP 10.3.31.42 > 10.3.31.211: ICMP echo request, id 35139, seq 6, length 64
10:05:20.217276 ARP, Request who-has 10.3.31.211 tell 10.3.31.42, length 46
10:05:20.217313 ARP, Request who-has 10.3.31.211 tell 10.3.31.42, length 46
10:05:20.217313 ARP, Request who-has 10.3.31.211 tell 10.3.31.42, length 46
10:05:20.217316 ARP, Request who-has 10.3.31.211 tell 10.3.31.42, length 46
10:05:20.217317 ARP, Request who-has 10.3.31.211 tell 10.3.31.42, length 46
10:05:20.217318 ARP, Request who-has 10.3.31.211 tell 10.3.31.42, length 46
10:05:20.217316 ARP, Request who-has 10.3.31.211 tell 10.3.31.42, length 46
10:05:20.217316 ARP, Request who-has 10.3.31.211 tell 10.3.31.42, length 46
10:05:20.217317 ARP, Request who-has 10.3.31.211 tell 10.3.31.42, length 46
10:05:20.217318 ARP, Request who-has 10.3.31.211 tell 10.3.31.42, length 46
10:05:20.217317 ARP, Request who-has 10.3.31.211 tell 10.3.31.42, length 46
10:05:20.217320 ARP, Request who-has 10.3.31.211 tell 10.3.31.42, length 46
10:05:20.217321 ARP, Reply 10.3.31.211 is-at 00:16:31:f2:45:6f (oui Unknown), length 46
10:05:20.217322 ARP, Reply 10.3.31.211 is-at 00:16:31:f2:45:6f (oui Unknown), length 46
10:05:20.217322 ARP, Reply 10.3.31.211 is-at 00:16:31:f2:45:6f (oui Unknown), length 46
10:05:20.217320 ARP, Reply 10.3.31.211 is-at 00:16:31:f2:45:6f (oui Unknown), length 46
10:05:20.217408 ARP, Reply 10.3.31.211 is-at 00:16:31:f2:45:6f (oui Unknown), length 28
10:05:21.209323 IP 10.3.31.42 > 10.3.31.211: ICMP echo request, id 35139, seq 7, length 64
10:05:22.209328 IP 10.3.31.42 > 10.3.31.211: ICMP echo request, id 35139, seq 8, length 64
10:05:23.209318 IP 10.3.31.42 > 10.3.31.211: ICMP echo request, id 35139, seq 9, length 64
10:05:24.209320 IP 10.3.31.42 > 10.3.31.211: ICMP echo request, id 35139, seq 10, length 64
10:05:25.209317 IP 10.3.31.42 > 10.3.31.211: ICMP echo request, id 35139, seq 11, length 64

**Comment by whl739** [comment]
Can i see your startup logs?

**Comment by phantomgps** [comment]
here is the start log:
[root@dpdk f-stack]# ./start.sh -b /usr/local/nginx_fstack/sbin/nginx -c ./config.ini
/usr/local/nginx_fstack/sbin/nginx ./config.ini -c 1 --proc-type=primary --num-procs=1 --proc-id=0
[dpdk]: lcore_mask=1
[dpdk]: channel=4
[dpdk]: nb_ports=2
[dpdk]: promiscuous=0
[dpdk]: numa_on=1
[dpdk]: tso=0
[port0]: addr=10.3.31.210
[port0]: netmask=255.255.255.0
[port0]: broadcast=10.3.31.255
[port0]: gateway=10.3.31.1
[port0]: pcap=./port0.pcap
[port1]: addr=10.3.31.211
[port1]: netmask=255.255.255.0
[port1]: broadcast=10.3.31.255
[port1]: gateway=10.3.31.1
[port1]: pcap=./port1.pcap
[freebsd.boot]: hz=100
[freebsd.boot]: kern.ipc.maxsockets=262144
[freebsd.boot]: net.inet.tcp.syncache.hashsize=4096
[freebsd.boot]: net.inet.tcp.syncache.bucketlimit=100
[freebsd.boot]: net.inet.tcp.tcbhashsize=65536
[freebsd.sysctl]: kern.ipc.somaxconn=327680
[freebsd.sysctl]: kern.ipc.maxsockbuf=16777216
[freebsd.sysctl]: net.inet.tcp.fast_finwait2_recycle=1
[freebsd.sysctl]: net.inet.tcp.sendspace=163840
[freebsd.sysctl]: net.inet.tcp.recvspace=81920
[freebsd.sysctl]: net.inet.tcp.nolocaltimewait=1
[freebsd.sysctl]: net.inet.tcp.cc.algorithm=bic
[freebsd.sysctl]: net.inet.tcp.sendbuf_max=16777216
[freebsd.sysctl]: net.inet.tcp.recvbuf_max=16777216
[freebsd.sysctl]: net.inet.tcp.sendbuf_auto=1
[freebsd.sysctl]: net.inet.tcp.recvbuf_auto=1
[freebsd.sysctl]: net.inet.tcp.sendbuf_inc=16384
[freebsd.sysctl]: net.inet.tcp.recvbuf_inc=524288
[freebsd.sysctl]: net.inet.tcp.inflight.enable=0
[freebsd.sysctl]: net.inet.tcp.sack=1
[freebsd.sysctl]: net.inet.tcp.blackhole=1
[freebsd.sysctl]: net.inet.tcp.msl=2000
[freebsd.sysctl]: net.inet.tcp.delayed_ack=0
[freebsd.sysctl]: net.inet.udp.blackhole=1
[freebsd.sysctl]: net.inet.ip.redirect=0
EAL: Detected 24 lcore(s)
EAL: PCI device 0000:03:00.0 on NUMA socket -1
EAL:   probe driver: 8086:10fb rte_ixgbe_pmd
EAL: PCI device 0000:03:00.1 on NUMA socket -1
EAL:   probe driver: 8086:10fb rte_ixgbe_pmd
create mbuf pool on socket 0
create ring:arp_ring_0_0 success, 2047 ring entries are now free!
create ring:arp_ring_0_1 success, 2047 ring entries are now free!
Port 0 MAC: 00 16 31 f2 45 6e
RX checksum offload supported
TX ip checksum offload supported
TX TCP&UDP checksum offload supported
TSO is disabled
Port 1 MAC: 00 16 31 f2 45 6f
RX checksum offload supported
TX ip checksum offload supported
TX TCP&UDP checksum offload supported
TSO is disabled

Checking link statusdone
Port 0 Link Up - speed 10000 Mbps - full-duplex
Port 1 Link Up - speed 10000 Mbps - full-duplex
link_elf_lookup_symbol: missing symbol hash table
link_elf_lookup_symbol: missing symbol hash table
netisr_init: forcing maxthreads from 1 to 0
Timecounters tick every 10.000 msec
Timecounter "ff_clock" frequency 100 Hz quality 1
f-stack-0: Ethernet address: 00:16:31:f2:45:6e
f-stack-1: Ethernet address: 00:16:31:f2:45:6f
ff_veth_set_gateway failed

[root@dpdk f-stack]#

**Comment by whl739** [comment]
What about setting `dpdk.promiscuous` to 1?

**Comment by phantomgps** [comment]
If I set promiscuous=1, both port0 and port1 can be ping, but they share the same MAC address,  when I test with wrk, all data traffic go to port0

**Comment by whl739** [comment]
Why they share  the same MAC address?
```
f-stack-0: Ethernet address: 00:16:31:f2:45:6e
f-stack-1: Ethernet address: 00:16:31:f2:45:6f
```
This shows they have different MAC addresses.

**Comment by phantomgps** [comment]
because in  promiscuous mode, port0 answer all arp request?
I'm not  familiar with BSD, but I know in Linux  net stack, it's not easy to make 2 NIC exist in a same LAN, they need to be added to different route table, even if the promicuous mode is not set.

**Comment by whl739** [comment]
Well, it's similar with BSD.
I have already ported `route` to F-Stack, maybe you can use it to set route.
I'll push it later.

**Comment by whl739** [comment]
@phantomgps 
I have pushed `route` to master branch.
Take a look at [tools/route](https://github.com/F-Stack/f-stack/tree/master/tools#route).

**Comment by yuwenhua** [comment]
which process should the "route" command attach to ? is nginx ok?

[root@dpdk f-stack]# ps auxf|grep nginx
root     22682  0.0  0.0 103324   804 pts/2    S+   09:01   0:00  |           \_ grep nginx
root     22621 95.8  0.0 4281344 48656 pts/2   Rl   09:01   0:15 /usr/local/nginx_fstack/sbin/nginx ./config.ini -c 1 --proc-type=primary --num-procs=1 --proc-id=0
[root@dpdk f-stack]# ./tools/route/route  -p 22621 show  10.3.31.0
lookup message ring:ff_msg_ring_in_22621 failed!
lookup message ring:ff_msg_ring_in_22621 failed!
route: writing to routing socket: Broken pipe

**Comment by whl739** [comment]
`-p` means the f-stack `proc-id`. It's range is from 0 to `num-procs - 1`.

**Comment by yuwenhua** [comment]
As described， nginx is a f-stack process, but it route command did't run properly

**Comment by whl739** [comment]
Can you paste your output?

` ./tools/route/route -p 0 show 10.3.31.0`

**Comment by yuwenhua** [comment]
[root@dpdk f-stack]# ./tools/route/route -p 0 show 10.3.31.0
route: writing to routing socket: Invalid argument
[root@dpdk f-stack]#


[root@dpdk f-stack]# ./tools/ifconfig/ifconfig
lo0: flags=8008<LOOPBACK,MULTICAST>
f-stack-0: flags=8843<UP,BROADCAST,RUNNING,SIMPLEX,MULTICAST>
        ether 0:16:31:f2:45:6e
        inet 10.3.31.210 netmask 0xffffff00 broadcast 10.3.31.255
f-stack-1: flags=8843<UP,BROADCAST,RUNNING,SIMPLEX,MULTICAST>
        ether 0:16:31:f2:45:6f
        inet 10.3.31.211 netmask 0xffffff00 broadcast 10.3.31.255
[root@dpdk f-stack]# ./tools/ifconfig/ifconfig -p 22621
lookup message ring:ff_msg_ring_in_22621 failed!
ifconfig: getifaddrs: Broken pipe

[root@dpdk f-stack]# ps a
  PID TTY      STAT   TIME COMMAND
 3332 ttyS0    Ss+    0:00 /sbin/agetty -h -L 115200 ttyS0 vt100+
 3337 tty1     Ss+    0:00 /sbin/mingetty /dev/tty1
 3339 tty2     Ss+    0:00 /sbin/mingetty /dev/tty2
 3342 tty3     Ss+    0:00 /sbin/mingetty /dev/tty3
 3344 tty4     Ss+    0:00 /sbin/mingetty /dev/tty4
 3346 tty5     Ss+    0:00 /sbin/mingetty /dev/tty5
 3348 tty6     Ss+    0:00 /sbin/mingetty /dev/tty6
18782 pts/6    Ss     0:00 -bash
18842 pts/6    S+     0:00 tmux attach
22398 pts/1    S+     0:01 top
**22621** pts/2    Rl    12:20 /usr/local/nginx_fstack/sbin/nginx ./config.ini -c 1 --proc-type=primary --num-procs=1 --proc-id=0
22868 pts/2    R+     0:00 ps a
24907 pts/4    Ss+    0:00 -bash

**Comment by whl739** [comment]
Did you update the codes including the lib directory and recompile?

**Comment by yuwenhua** [comment]
sure,
[yuwh@dpdk f-stack]$ git pull origin
Already up-to-date.
[yuwh@dpdk f-stack]$

**Comment by whl739** [comment]
It doesn't make sense. It's my output:
```
root@dp:~/f-stack/tools/route# ./route -p 0 show 10.3.31.10
   route to: 10.3.31.10
destination: 0.0.0.0
           mask: 0.0.0.0
        gateway: 192.168.1.1
                fib: 0
  interface: f-stack-0
          flags: <UP,GATEWAY,DONE>
 recvpipe  sendpipe  ssthresh  rtt,msec    mtu        weight    expire
       0         0         0         0      1500         1         0 
```
Did you recompile nginx too?

**Comment by yuwenhua** [comment]
yes, I'll try to clone a new repository and try again, not sure my modification to some code will affect this or not
