### ISSUE TITLE
Curl may fail after delete arp entry.

### ISSUE THREAD

**Issue by beacer** [F-Stack/f-stack#112]
Curl from host to f-stack may fail after host delete f-stack's ARP entry. This issue may related to #111.
f-stack is `192.168.204.51`, and host is `192.168.204.56`.
To reproduce it, just delete f-stack's ARP entry on host, and try curl continuously, it will fail after some trails.
```
host $ ip neigh del 192.168.204.51 dev eth0
host $ curl 192.168.204.51                                                                                                                                                                                              
Ok
host $ curl 192.168.204.51
Ok
... success for about 15 times ...
host $ curl 192.168.204.51
curl: (7) Failed connect to 192.168.204.51:80; Connection timed out
```

And packet capture shows on response from f-stack.

```
13:57:16.122439 IP 192.168.204.56.57918 > 192.168.204.51.80: Flags [.], ack 1, win 21, length 0
13:57:16.122521 IP 192.168.204.56.57918 > 192.168.204.51.80: Flags [P.], seq 1:79, ack 1, win 21, length 78
13:57:16.122622 IP 192.168.204.51.80 > 192.168.204.56.57918: Flags [.], ack 79, win 16, length 0
13:57:16.122630 IP 192.168.204.51.80 > 192.168.204.56.57918: Flags [P.], seq 1:147, ack 79, win 17, length 146
13:57:16.122637 IP 192.168.204.56.57918 > 192.168.204.51.80: Flags [.], ack 147, win 22, length 0
13:57:16.122640 IP 192.168.204.51.80 > 192.168.204.56.57918: Flags [F.], seq 147, ack 79, win 17, length 0
13:57:16.122714 IP 192.168.204.56.57918 > 192.168.204.51.80: Flags [F.], seq 79, ack 148, win 22, length 0
13:57:16.122820 IP 192.168.204.51.80 > 192.168.204.56.57918: Flags [.], ack 80, win 17, length 0
13:57:16.578311 IP 192.168.204.56.57919 > 192.168.204.51.80: Flags [S], seq 3636567719, win 42340, options [mss 1460,nop,nop,sackOK,nop,wscale 11], length 0
13:57:16.578364 IP 192.168.204.51.80 > 192.168.204.56.57919: Flags [S.], seq 3837727515, ack 3636567720, win 8192, options [mss 1460,nop,wscale 9,sackOK,eol], length 0
13:57:16.578380 IP 192.168.204.56.57919 > 192.168.204.51.80: Flags [.], ack 1, win 21, length 0
13:57:16.578433 IP 192.168.204.56.57919 > 192.168.204.51.80: Flags [P.], seq 1:79, ack 1, win 21, length 78
13:57:16.578480 IP 192.168.204.51.80 > 192.168.204.56.57919: Flags [.], ack 79, win 16, length 0
13:57:16.578498 IP 192.168.204.51.80 > 192.168.204.56.57919: Flags [P.], seq 1:147, ack 79, win 17, length 146
13:57:16.578504 IP 192.168.204.56.57919 > 192.168.204.51.80: Flags [.], ack 147, win 22, length 0
13:57:16.578506 IP 192.168.204.51.80 > 192.168.204.56.57919: Flags [F.], seq 147, ack 79, win 17, length 0
13:57:16.578600 IP 192.168.204.56.57919 > 192.168.204.51.80: Flags [F.], seq 79, ack 148, win 22, length 0
13:57:16.578680 IP 192.168.204.51.80 > 192.168.204.56.57919: Flags [.], ack 80, win 17, length 0
13:57:17.050372 IP 192.168.204.56.57920 > 192.168.204.51.80: Flags [S], seq 1660335084, win 42340, options [mss 1460,nop,nop,sackOK,nop,wscale 11], length 0
13:57:18.051502 IP 192.168.204.56.57920 > 192.168.204.51.80: Flags [S], seq 1660335084, win 42340, options [mss 1460,nop,nop,sackOK,nop,wscale 11], length 0
13:57:20.055538 IP 192.168.204.56.57920 > 192.168.204.51.80: Flags [S], seq 1660335084, win 42340, options [mss 1460,nop,nop,sackOK,nop,wscale 11], length 0
```

**Comment by whl739** [comment]
Compare the packet capture from f-stack side.
And i will try to reproduce it.
