### ISSUE TITLE
SYN packet not received by f-stack?

### ISSUE THREAD

**Issue by vincentmli** [F-Stack/f-stack#94]
Hi 

I have a weird issue that I am tracing for a while, I have two Dell servers with dual port Intel 82599 NIC, I used fiber cable to connect the port directly

<pre>
Dell R710  enp4s0f1 <<SFP module--fiber cable--SFP module>> DPDK port 0 Dell R210 Nginx+F-Stack

run following command concurrently

on Dell R210

1 

#/usr/local/nginx_fstack/sbin/nginx
nginx: [warn] 102400 worker_connections exceed open file resource limit: 1024

2, enabled f-stack pcap and read the pcap file alive

 tail -c +1 -f a.pcap | tcpdump -l -nn -r -

10:28:10.110392 ARP, Request who-has 10.8.8.2 tell 10.8.8.8, length 46
10:28:10.110392 ARP, Reply 10.8.8.2 is-at 90:e2:ba:93:26:0e, length 28
10:28:40.162113 ARP, Request who-has 10.8.8.2 tell 10.8.8.8, length 46
10:28:40.162113 ARP, Reply 10.8.8.2 is-at 90:e2:ba:93:26:0e, length 28
10:29:12.223956 ARP, Request who-has 10.8.8.2 tell 10.8.8.8, length 46
10:29:12.223956 ARP, Reply 10.8.8.2 is-at 90:e2:ba:93:26:0e, length 28
^Ctcpdump: pcap_loop: error reading dump file: Interrupted system call

on Dell R710

3 curl to send http request to f-stack nginx

 #curl http://10.8.8.2/

4, tcpdump on  enp4s0f1

root@controller-dell710:~# tcpdump -nn -i enp4s0f1
tcpdump: verbose output suppressed, use -v or -vv for full protocol decode
listening on enp4s0f1, link-type EN10MB (Ethernet), capture size 262144 bytes

10:28:04.117910 IP 10.8.8.8.54150 > 10.8.8.2.80: Flags [S], seq 1657514904, win 29200, options [mss 1460,sackOK,TS val 38591663 ecr 0,nop,wscale 7], length 0
10:28:05.115173 IP 10.8.8.8.54150 > 10.8.8.2.80: Flags [S], seq 1657514904, win 29200, options [mss 1460,sackOK,TS val 38591913 ecr 0,nop,wscale 7], length 0
10:28:07.119171 IP 10.8.8.8.54150 > 10.8.8.2.80: Flags [S], seq 1657514904, win 29200, options [mss 1460,sackOK,TS val 38592414 ecr 0,nop,wscale 7], length 0
10:28:10.119177 ARP, Request who-has 10.8.8.2 tell 10.8.8.8, length 28
10:28:10.119309 ARP, Reply 10.8.8.2 is-at 90:e2:ba:93:26:0e, length 46
10:28:11.127174 IP 10.8.8.8.54150 > 10.8.8.2.80: Flags [S], seq 1657514904, win 29200, options [mss 1460,sackOK,TS val 38593416 ecr 0,nop,wscale 7], length 0
10:28:19.143174 IP 10.8.8.8.54150 > 10.8.8.2.80: Flags [S], seq 1657514904, win 29200, options [mss 1460,sackOK,TS val 38595420 ecr 0,nop,wscale 7], length 0
10:28:35.159191 IP 10.8.8.8.54150 > 10.8.8.2.80: Flags [S], seq 1657514904, win 29200, options [mss 1460,sackOK,TS val 38599424 ecr 0,nop,wscale 7], length 0
10:28:40.167166 ARP, Request who-has 10.8.8.2 tell 10.8.8.8, length 28
10:28:40.167325 ARP, Reply 10.8.8.2 is-at 90:e2:ba:93:26:0e, length 46
10:29:07.223181 IP 10.8.8.8.54150 > 10.8.8.2.80: Flags [S], seq 1657514904, win 29200, options [mss 1460,sackOK,TS val 38607440 ecr 0,nop,wscale 7], length 0
10:29:12.231155 ARP, Request who-has 10.8.8.2 tell 10.8.8.8, length 28
10:29:12.231318 ARP, Reply 10.8.8.2 is-at 90:e2:ba:93:26:0e, length 46
^C
13 packets captured
13 packets received by filter
0 packets dropped by kernel
</pre>
as you can see from pcap, the ARP request is received by F-Stack and ARP replied by F-Stack, but it appears the SYN packet disappeared at F-Stack and not even showing in the F-Stack a.pcap.  if I run curl in loop and once in a while, curl could get successful response, but the success rate is very few. 

I initially thought maybe I have issue at physical layer like cables, bad NICs..etc. but if stop using F-Stack Ngnix, just running OS distribution  Nginx, the curl test always works, I even tried mTCP epserver which runs on DPDK port on the same physical NIC port, my curl test always works with mTCP epserver, so suspect the issue still within F-Stack.

here is my f-stack.conf: (SKIPPED THE FREEBSD PART, NOTHING CHANGED)
<pre>
[dpdk]
## Hexadecimal bitmask of cores to run on.
lcore_mask=ff
channel=4
promiscuous=1
numa_on=1
## TCP segment offload, default: disabled.
tso=0
## HW vlan strip, default: enabled.
vlan_strip=1

# enabled port list
#
# EBNF grammar:
#
#    exp      ::= num_list {"," num_list}
#    num_list ::= <num> | <range>
#    range    ::= <num>"-"<num>
#    num      ::= '0' | '1' | '2' | '3' | '4' | '5' | '6' | '7' | '8' | '9'
#
# examples
#    1-3       ports 1,2,3 are enabled
#    1-3,4,7   ports 1,2,3,4,7 are enabled
port_list=0

## According to dpdk.nb_ports: port0, port1...
[port0]
addr=10.8.8.2
netmask=255.255.0.0
broadcast=10.8.255.255
gateway=10.8.8.8
# lcore list used to handle this port
# the format is same as port_list

# lcore_list= 0

## Packet capture path, this will hurt performance
pcap=./a.pcap

## the following tcp_port and udp_port will transmit to kernel.
#[kni]
#enable=1
#method=reject
#tcp_port=80,443
#udp_port=53
</pre>
the process_packets() in lib/ff_dpdk_if.c looks  straightforward, the ff_dump_packets should have captured everything if pcap enabled, the pcap not showing SYN packet appears to indicate something going on before process_packets?

**Comment by vincentmli** [comment]
in case it helps, here is f-stack nginx output with daemon off:

<pre>
nginx: [warn] 102400 worker_connections exceed open file resource limit: 1024
[dpdk]: lcore_mask=ff
[dpdk]: channel=4
[dpdk]: promiscuous=1
[dpdk]: numa_on=1
[dpdk]: tso=0
[dpdk]: vlan_strip=1
[dpdk]: port_list=0
[port0]: addr=10.8.8.2
[port0]: netmask=255.255.0.0
[port0]: broadcast=10.8.255.255
[port0]: gateway=10.8.8.8
[port0]: pcap=./a.pcap
[freebsd.boot]: hz=100
[freebsd.boot]: fd_reserve=1024
[freebsd.boot]: kern.ipc.maxsockets=262144
[freebsd.boot]: net.inet.tcp.syncache.hashsize=4096
[freebsd.boot]: net.inet.tcp.syncache.bucketlimit=100
[freebsd.boot]: net.inet.tcp.tcbhashsize=65536
[freebsd.sysctl]: kern.ipc.somaxconn=32768
[freebsd.sysctl]: kern.ipc.maxsockbuf=16777216
[freebsd.sysctl]: net.inet.tcp.fast_finwait2_recycle=1
[freebsd.sysctl]: net.inet.tcp.sendspace=16384
[freebsd.sysctl]: net.inet.tcp.recvspace=8192
[freebsd.sysctl]: net.inet.tcp.nolocaltimewait=1
[freebsd.sysctl]: net.inet.tcp.cc.algorithm=cubic
[freebsd.sysctl]: net.inet.tcp.sendbuf_max=16777216
[freebsd.sysctl]: net.inet.tcp.recvbuf_max=16777216
[freebsd.sysctl]: net.inet.tcp.sendbuf_auto=1
[freebsd.sysctl]: net.inet.tcp.recvbuf_auto=1
[freebsd.sysctl]: net.inet.tcp.sendbuf_inc=16384
[freebsd.sysctl]: net.inet.tcp.recvbuf_inc=524288
[freebsd.sysctl]: net.inet.tcp.sack.enable=1
[freebsd.sysctl]: net.inet.tcp.blackhole=1
[freebsd.sysctl]: net.inet.tcp.msl=2000
[freebsd.sysctl]: net.inet.tcp.delayed_ack=0
[freebsd.sysctl]: net.inet.udp.blackhole=1
[freebsd.sysctl]: net.inet.ip.redirect=0
EAL: Detected 8 lcore(s)
EAL: Probing VFIO support...
EAL: PCI device 0000:01:00.0 on NUMA socket 0
EAL:   probe driver: 8086:10fb rte_ixgbe_pmd
EAL: PCI device 0000:01:00.1 on NUMA socket 0
EAL:   probe driver: 8086:10fb rte_ixgbe_pmd
lcore: 0, port: 0, queue: 0
create mbuf pool on socket 0
create ring:arp_ring_p0_q0 success, 2047 ring entries are now free!
create ring:arp_ring_p0_q1 success, 2047 ring entries are now free!
create ring:arp_ring_p0_q2 success, 2047 ring entries are now free!
create ring:arp_ring_p0_q3 success, 2047 ring entries are now free!
create ring:arp_ring_p0_q4 success, 2047 ring entries are now free!
create ring:arp_ring_p0_q5 success, 2047 ring entries are now free!
create ring:arp_ring_p0_q6 success, 2047 ring entries are now free!
create ring:arp_ring_p0_q7 success, 2047 ring entries are now free!
Port 0 MAC: 90 e2 ba 93 26 0e
RX checksum offload supported
TX ip checksum offload supported
TX TCP&UDP checksum offload supported
TSO is disabled
port[0]: rss table size: 128
rte_eth_dev_config_restore: port 0: MAC address array not supported
PMD: ixgbe_dev_filter_ctrl(): Filter type (8) not supported <====does it matter here?
set port 0 to promiscuous mode ok

Checking link status.done
Port 0 Link Up - speed 10000 Mbps - full-duplex
link_elf_lookup_symbol: missing symbol hash table
link_elf_lookup_symbol: missing symbol hash table <=====does it matter here ?
netisr_init: forcing maxthreads from 1 to 0
Timecounters tick every 10.000 msec
Timecounter "ff_clock" frequency 100 Hz quality 1
f-stack-0: Ethernet address: 90:e2:ba:93:26:0e
</pre>

**Comment by vincentmli** [comment]
I am able to fix the problem by disable NUMA setting  since Ubuntu 16.04 on Dell R210 server does not have NUMA support

dmesg | grep -i numa
[    0.000000] No NUMA configuration found

<pre>

root@compute1:/home/vincent/f-stack# /usr/local/nginx_fstack/sbin/nginx
nginx: [warn] 102400 worker_connections exceed open file resource limit: 1024
[dpdk]: lcore_mask=ff  
[dpdk]: channel=4
[dpdk]: promiscuous=1
[dpdk]: numa_on=0 <============SET NUMA OFF
[dpdk]: tso=0
[dpdk]: vlan_strip=1
[dpdk]: port_list=0
[port0]: addr=10.8.8.2
[port0]: netmask=255.255.0.0
[port0]: broadcast=10.8.255.255
[port0]: gateway=10.8.8.8
[port0]: lcore_list=0-7 <=============LCORE 0-7
[port0]: pcap=./a.pcap
[freebsd.boot]: hz=100
[freebsd.boot]: fd_reserve=1024
[freebsd.boot]: kern.ipc.maxsockets=262144
[freebsd.boot]: net.inet.tcp.syncache.hashsize=4096
[freebsd.boot]: net.inet.tcp.syncache.bucketlimit=100
[freebsd.boot]: net.inet.tcp.tcbhashsize=65536
[freebsd.sysctl]: kern.ipc.somaxconn=32768
[freebsd.sysctl]: kern.ipc.maxsockbuf=16777216
[freebsd.sysctl]: net.inet.tcp.fast_finwait2_recycle=1
[freebsd.sysctl]: net.inet.tcp.sendspace=16384
[freebsd.sysctl]: net.inet.tcp.recvspace=8192
[freebsd.sysctl]: net.inet.tcp.nolocaltimewait=1
[freebsd.sysctl]: net.inet.tcp.cc.algorithm=cubic
[freebsd.sysctl]: net.inet.tcp.sendbuf_max=16777216
[freebsd.sysctl]: net.inet.tcp.recvbuf_max=16777216
[freebsd.sysctl]: net.inet.tcp.sendbuf_auto=1
[freebsd.sysctl]: net.inet.tcp.recvbuf_auto=1
[freebsd.sysctl]: net.inet.tcp.sendbuf_inc=16384
[freebsd.sysctl]: net.inet.tcp.recvbuf_inc=524288
[freebsd.sysctl]: net.inet.tcp.sack.enable=1
[freebsd.sysctl]: net.inet.tcp.blackhole=1
[freebsd.sysctl]: net.inet.tcp.msl=2000
[freebsd.sysctl]: net.inet.tcp.delayed_ack=0
[freebsd.sysctl]: net.inet.udp.blackhole=1
[freebsd.sysctl]: net.inet.ip.redirect=0
EAL: Detected 8 lcore(s) <=========================
EAL: Probing VFIO support...
EAL: PCI device 0000:01:00.0 on NUMA socket 0 <========
EAL:   probe driver: 8086:10fb rte_ixgbe_pmd
EAL: PCI device 0000:01:00.1 on NUMA socket 0 <=======
EAL:   probe driver: 8086:10fb rte_ixgbe_pmd
lcore: 0, port: 0, queue: 0 <============
create mbuf pool on socket 0
create ring:arp_ring_p0_q0 success, 2047 ring entries are now free!
create ring:arp_ring_p0_q1 success, 2047 ring entries are now free!
create ring:arp_ring_p0_q2 success, 2047 ring entries are now free!
create ring:arp_ring_p0_q3 success, 2047 ring entries are now free!
create ring:arp_ring_p0_q4 success, 2047 ring entries are now free!
create ring:arp_ring_p0_q5 success, 2047 ring entries are now free!
create ring:arp_ring_p0_q6 success, 2047 ring entries are now free!
create ring:arp_ring_p0_q7 success, 2047 ring entries are now free!
Port 0 MAC: 90 e2 ba 93 26 0e
RX checksum offload supported
TX ip checksum offload supported
TX TCP&UDP checksum offload supported
TSO is disabled
port[0]: rss table size: 128
rte_eth_dev_config_restore: port 0: MAC address array not supported
PMD: ixgbe_dev_filter_ctrl(): Filter type (8) not supported
set port 0 to promiscuous mode ok

Checking link status.done
Port 0 Link Up - speed 10000 Mbps - full-duplex
link_elf_lookup_symbol: missing symbol hash table
link_elf_lookup_symbol: missing symbol hash table
netisr_init: forcing maxthreads from 1 to 0
Timecounters tick every 10.000 msec
Timecounter "ff_clock" frequency 100 Hz quality 1
f-stack-0: Ethernet address: 90:e2:ba:93:26:0e
[dpdk]: lcore_mask=ff
[dpdk]: channel=4
[dpdk]: promiscuous=1
[dpdk]: numa_on=0
[dpdk]: tso=0
[dpdk]: vlan_strip=1
[dpdk]: port_list=0
[port0]: addr=10.8.8.2
[port0]: netmask=255.255.0.0
[port0]: broadcast=10.8.255.255
[port0]: gateway=10.8.8.8
[port0]: lcore_list=0-7
[port0]: pcap=./a.pcap
[freebsd.boot]: hz=100
[freebsd.boot]: fd_reserve=1024
[freebsd.boot]: kern.ipc.maxsockets=262144
[freebsd.boot]: net.inet.tcp.syncache.hashsize=4096
[freebsd.boot]: net.inet.tcp.syncache.bucketlimit=100
[freebsd.boot]: net.inet.tcp.tcbhashsize=65536
[freebsd.sysctl]: kern.ipc.somaxconn=32768
[freebsd.sysctl]: kern.ipc.maxsockbuf=16777216
[freebsd.sysctl]: net.inet.tcp.fast_finwait2_recycle=1
[freebsd.sysctl]: net.inet.tcp.sendspace=16384
[freebsd.sysctl]: net.inet.tcp.recvspace=8192
[freebsd.sysctl]: net.inet.tcp.nolocaltimewait=1
[freebsd.sysctl]: net.inet.tcp.cc.algorithm=cubic
[freebsd.sysctl]: net.inet.tcp.sendbuf_max=16777216
[freebsd.sysctl]: net.inet.tcp.recvbuf_max=16777216
[freebsd.sysctl]: net.inet.tcp.sendbuf_auto=1
[freebsd.sysctl]: net.inet.tcp.recvbuf_auto=1
[freebsd.sysctl]: net.inet.tcp.sendbuf_inc=16384
[freebsd.sysctl]: net.inet.tcp.recvbuf_inc=524288
[freebsd.sysctl]: net.inet.tcp.sack.enable=1
[freebsd.sysctl]: net.inet.tcp.blackhole=1
[freebsd.sysctl]: net.inet.tcp.msl=2000
[freebsd.sysctl]: net.inet.tcp.delayed_ack=0
[freebsd.sysctl]: net.inet.udp.blackhole=1
[freebsd.sysctl]: net.inet.ip.redirect=0
[dpdk]: lcore_mask=ff
[dpdk]: channel=4
[dpdk]: promiscuous=1
[dpdk]: numa_on=0
[dpdk]: tso=0
[dpdk]: vlan_strip=1
[dpdk]: port_list=0
[port0]: addr=10.8.8.2
[port0]: netmask=255.255.0.0
[port0]: broadcast=10.8.255.255
[port0]: gateway=10.8.8.8
[port0]: lcore_list=0-7
[port0]: pcap=./a.pcap
[freebsd.boot]: hz=100
[freebsd.boot]: fd_reserve=1024
[freebsd.boot]: kern.ipc.maxsockets=262144
EAL: Detected 8 lcore(s)
[freebsd.boot]: net.inet.tcp.syncache.hashsize=4096
[freebsd.boot]: net.inet.tcp.syncache.bucketlimit=100
[freebsd.boot]: net.inet.tcp.tcbhashsize=65536
[freebsd.sysctl]: kern.ipc.somaxconn=32768
[freebsd.sysctl]: kern.ipc.maxsockbuf=16777216
[freebsd.sysctl]: net.inet.tcp.fast_finwait2_recycle=1
[freebsd.sysctl]: net.inet.tcp.sendspace=16384
[freebsd.sysctl]: net.inet.tcp.recvspace=8192
[freebsd.sysctl]: net.inet.tcp.nolocaltimewait=1
[freebsd.sysctl]: net.inet.tcp.cc.algorithm=cubic
[freebsd.sysctl]: net.inet.tcp.sendbuf_max=16777216
[freebsd.sysctl]: net.inet.tcp.recvbuf_max=16777216
[freebsd.sysctl]: net.inet.tcp.sendbuf_auto=1
[freebsd.sysctl]: net.inet.tcp.recvbuf_auto=1
[freebsd.sysctl]: net.inet.tcp.sendbuf_inc=16384
[freebsd.sysctl]: net.inet.tcp.recvbuf_inc=524288
[freebsd.sysctl]: net.inet.tcp.sack.enable=1
[freebsd.sysctl]: net.inet.tcp.blackhole=1
[freebsd.sysctl]: net.inet.tcp.msl=2000
[freebsd.sysctl]: net.inet.tcp.delayed_ack=0
[freebsd.sysctl]: net.inet.udp.blackhole=1
[freebsd.sysctl]: net.inet.ip.redirect=0
EAL: Detected 8 lcore(s)
EAL: Probing VFIO support...
EAL: WARNING: Address Space Layout Randomization (ASLR) is enabled in the kernel.
EAL:    This may cause issues with mapping memory into secondary processes
EAL: Probing VFIO support...
EAL: WARNING: Address Space Layout Randomization (ASLR) is enabled in the kernel.
EAL:    This may cause issues with mapping memory into secondary processes
[dpdk]: lcore_mask=ff
[dpdk]: lcore_mask=ff
[dpdk]: lcore_mask=ff
[dpdk]: channel=4
[dpdk]: channel=4
[dpdk]: channel=4
[dpdk]: promiscuous=1
[dpdk]: numa_on=0
[dpdk]: promiscuous=1
[dpdk]: numa_on=0
[dpdk]: lcore_mask=ff
[dpdk]: channel=4
[dpdk]: promiscuous=1
[dpdk]: promiscuous=1
[dpdk]: tso=0
[dpdk]: numa_on=0
[dpdk]: tso=0
[dpdk]: vlan_strip=1
[dpdk]: vlan_strip=1
[dpdk]: port_list=0
[dpdk]: tso=0
[dpdk]: numa_on=0
[dpdk]: port_list=0
[port0]: addr=10.8.8.2
[port0]: netmask=255.255.0.0
[dpdk]: lcore_mask=ff
[dpdk]: tso=0
[dpdk]: vlan_strip=1
[dpdk]: channel=4
[port0]: broadcast=10.8.255.255
[dpdk]: promiscuous=1
[dpdk]: port_list=0
[dpdk]: numa_on=0
[dpdk]: tso=0
[port0]: gateway=10.8.8.8
[port0]: addr=10.8.8.2
[port0]: netmask=255.255.0.0
[dpdk]: vlan_strip=1
[port0]: lcore_list=0-7
[port0]: broadcast=10.8.255.255
[port0]: pcap=./a.pcap
[freebsd.boot]: hz=100
[freebsd.boot]: fd_reserve=1024
[freebsd.boot]: kern.ipc.maxsockets=262144
[freebsd.boot]: net.inet.tcp.syncache.hashsize=4096
[freebsd.boot]: net.inet.tcp.syncache.bucketlimit=100
[freebsd.boot]: net.inet.tcp.tcbhashsize=65536
[freebsd.sysctl]: kern.ipc.somaxconn=32768
[freebsd.sysctl]: kern.ipc.maxsockbuf=16777216
[freebsd.sysctl]: net.inet.tcp.fast_finwait2_recycle=1
[freebsd.sysctl]: net.inet.tcp.sendspace=16384
[freebsd.sysctl]: net.inet.tcp.recvspace=8192
[freebsd.sysctl]: net.inet.tcp.nolocaltimewait=1
[freebsd.sysctl]: net.inet.tcp.cc.algorithm=cubic
[freebsd.sysctl]: net.inet.tcp.sendbuf_max=16777216
[freebsd.sysctl]: net.inet.tcp.recvbuf_max=16777216
[freebsd.sysctl]: net.inet.tcp.sendbuf_auto=1
[freebsd.sysctl]: net.inet.tcp.recvbuf_auto=1
[freebsd.sysctl]: net.inet.tcp.sendbuf_inc=16384
[freebsd.sysctl]: net.inet.tcp.recvbuf_inc=524288
[freebsd.sysctl]: net.inet.tcp.sack.enable=1
[freebsd.sysctl]: net.inet.tcp.blackhole=1
[freebsd.sysctl]: net.inet.tcp.msl=2000
[freebsd.sysctl]: net.inet.tcp.delayed_ack=0
[freebsd.sysctl]: net.inet.udp.blackhole=1
[freebsd.sysctl]: net.inet.ip.redirect=0
EAL: Detected 8 lcore(s)
EAL: Probing VFIO support...
EAL: WARNING: Address Space Layout Randomization (ASLR) is enabled in the kernel.
EAL:    This may cause issues with mapping memory into secondary processes
[dpdk]: vlan_strip=1
[port0]: addr=10.8.8.2
[port0]: netmask=255.255.0.0
[port0]: broadcast=10.8.255.255
[port0]: gateway=10.8.8.8
[dpdk]: port_list=0
[port0]: lcore_list=0-7
[port0]: pcap=./a.pcap
[port0]: addr=10.8.8.2
[freebsd.boot]: hz=100
[freebsd.boot]: fd_reserve=1024
[dpdk]: port_list=0
[port0]: netmask=255.255.0.0
[port0]: broadcast=10.8.255.255
[port0]: gateway=10.8.8.8
[port0]: lcore_list=0-7
[port0]: pcap=./a.pcap
[freebsd.boot]: hz=100
[freebsd.boot]: fd_reserve=1024
[freebsd.boot]: kern.ipc.maxsockets=262144
[freebsd.boot]: net.inet.tcp.syncache.hashsize=4096
[freebsd.boot]: net.inet.tcp.syncache.bucketlimit=100
[freebsd.boot]: net.inet.tcp.tcbhashsize=65536
[freebsd.sysctl]: kern.ipc.somaxconn=32768
[freebsd.sysctl]: kern.ipc.maxsockbuf=16777216
[freebsd.sysctl]: net.inet.tcp.fast_finwait2_recycle=1
[freebsd.sysctl]: net.inet.tcp.sendspace=16384
[freebsd.sysctl]: net.inet.tcp.recvspace=8192
[freebsd.sysctl]: net.inet.tcp.nolocaltimewait=1
[freebsd.sysctl]: net.inet.tcp.cc.algorithm=cubic
[freebsd.sysctl]: net.inet.tcp.sendbuf_max=16777216
[freebsd.sysctl]: net.inet.tcp.recvbuf_max=16777216
[freebsd.sysctl]: net.inet.tcp.sendbuf_auto=1
[freebsd.sysctl]: net.inet.tcp.recvbuf_auto=1
[port0]: gateway=10.8.8.8
[freebsd.boot]: kern.ipc.maxsockets=262144
[freebsd.boot]: net.inet.tcp.syncache.hashsize=4096
[port0]: lcore_list=0-7
[port0]: pcap=./a.pcap
[freebsd.boot]: hz=100
[freebsd.boot]: net.inet.tcp.syncache.bucketlimit=100
[freebsd.boot]: fd_reserve=1024
[freebsd.boot]: net.inet.tcp.tcbhashsize=65536
[freebsd.boot]: kern.ipc.maxsockets=262144
[freebsd.sysctl]: kern.ipc.somaxconn=32768
[freebsd.boot]: net.inet.tcp.syncache.hashsize=4096
[freebsd.sysctl]: kern.ipc.maxsockbuf=16777216
[freebsd.boot]: net.inet.tcp.syncache.bucketlimit=100
[freebsd.sysctl]: net.inet.tcp.fast_finwait2_recycle=1
[freebsd.boot]: net.inet.tcp.tcbhashsize=65536
[freebsd.sysctl]: net.inet.tcp.sendspace=16384
[freebsd.sysctl]: kern.ipc.somaxconn=32768
[freebsd.sysctl]: net.inet.tcp.recvspace=8192
[freebsd.sysctl]: kern.ipc.maxsockbuf=16777216
[freebsd.sysctl]: net.inet.tcp.nolocaltimewait=1
[freebsd.sysctl]: net.inet.tcp.fast_finwait2_recycle=1
[freebsd.sysctl]: net.inet.tcp.cc.algorithm=cubic
[freebsd.sysctl]: net.inet.tcp.sendspace=16384
[freebsd.sysctl]: net.inet.tcp.sendbuf_max=16777216
[freebsd.sysctl]: net.inet.tcp.recvspace=8192
[freebsd.sysctl]: net.inet.tcp.recvbuf_max=16777216
[freebsd.sysctl]: net.inet.tcp.nolocaltimewait=1
[freebsd.sysctl]: net.inet.tcp.sendbuf_auto=1
[freebsd.sysctl]: net.inet.tcp.cc.algorithm=cubic
[freebsd.sysctl]: net.inet.tcp.recvbuf_auto=1
[freebsd.sysctl]: net.inet.tcp.sendbuf_max=16777216
[freebsd.sysctl]: net.inet.tcp.sendbuf_inc=16384
[freebsd.sysctl]: net.inet.tcp.recvbuf_max=16777216
[freebsd.sysctl]: net.inet.tcp.recvbuf_inc=524288
[freebsd.sysctl]: net.inet.tcp.sendbuf_auto=1
[freebsd.sysctl]: net.inet.tcp.sack.enable=1
[freebsd.sysctl]: net.inet.tcp.recvbuf_auto=1
[freebsd.sysctl]: net.inet.tcp.blackhole=1
[freebsd.sysctl]: net.inet.tcp.sendbuf_inc=16384
[freebsd.sysctl]: net.inet.tcp.msl=2000
[freebsd.sysctl]: net.inet.tcp.recvbuf_inc=524288
[freebsd.sysctl]: net.inet.tcp.delayed_ack=0
[freebsd.sysctl]: net.inet.tcp.sack.enable=1
[freebsd.sysctl]: net.inet.udp.blackhole=1
[freebsd.sysctl]: net.inet.tcp.blackhole=1
[freebsd.sysctl]: net.inet.ip.redirect=0
[freebsd.sysctl]: net.inet.tcp.msl=2000
[freebsd.sysctl]: net.inet.tcp.delayed_ack=0
[freebsd.sysctl]: net.inet.udp.blackhole=1
[freebsd.sysctl]: net.inet.ip.redirect=0
[port0]: addr=10.8.8.2
[freebsd.sysctl]: net.inet.tcp.sendbuf_inc=16384
[port0]: netmask=255.255.0.0
[freebsd.sysctl]: net.inet.tcp.recvbuf_inc=524288
[port0]: broadcast=10.8.255.255
[freebsd.sysctl]: net.inet.tcp.sack.enable=1
[freebsd.sysctl]: net.inet.tcp.blackhole=1
[port0]: gateway=10.8.8.8
[freebsd.sysctl]: net.inet.tcp.msl=2000
[freebsd.sysctl]: net.inet.tcp.delayed_ack=0
[port0]: lcore_list=0-7
[freebsd.sysctl]: net.inet.udp.blackhole=1
[port0]: pcap=./a.pcap
[freebsd.sysctl]: net.inet.ip.redirect=0
[freebsd.boot]: hz=100
[freebsd.boot]: fd_reserve=1024
[freebsd.boot]: kern.ipc.maxsockets=262144
[freebsd.boot]: net.inet.tcp.syncache.hashsize=4096
[freebsd.boot]: net.inet.tcp.syncache.bucketlimit=100
[freebsd.boot]: net.inet.tcp.tcbhashsize=65536
[freebsd.sysctl]: kern.ipc.somaxconn=32768
[freebsd.sysctl]: kern.ipc.maxsockbuf=16777216
[freebsd.sysctl]: net.inet.tcp.fast_finwait2_recycle=1
[freebsd.sysctl]: net.inet.tcp.sendspace=16384
[freebsd.sysctl]: net.inet.tcp.recvspace=8192
[freebsd.sysctl]: net.inet.tcp.nolocaltimewait=1
[freebsd.sysctl]: net.inet.tcp.cc.algorithm=cubic
[freebsd.sysctl]: net.inet.tcp.sendbuf_max=16777216
[freebsd.sysctl]: net.inet.tcp.recvbuf_max=16777216
[freebsd.sysctl]: net.inet.tcp.sendbuf_auto=1
[freebsd.sysctl]: net.inet.tcp.recvbuf_auto=1
[freebsd.sysctl]: net.inet.tcp.sendbuf_inc=16384
[freebsd.sysctl]: net.inet.tcp.recvbuf_inc=524288
[freebsd.sysctl]: net.inet.tcp.sack.enable=1
[freebsd.sysctl]: net.inet.tcp.blackhole=1
[freebsd.sysctl]: net.inet.tcp.msl=2000
[freebsd.sysctl]: net.inet.tcp.delayed_ack=0
[freebsd.sysctl]: net.inet.udp.blackhole=1
[freebsd.sysctl]: net.inet.ip.redirect=0
EAL: Detected 8 lcore(s)
EAL: Detected 8 lcore(s)
EAL: Detected 8 lcore(s)
EAL: Detected 8 lcore(s)
EAL: Probing VFIO support...
EAL: WARNING: Address Space Layout Randomization (ASLR) is enabled in the kernel.
EAL:    This may cause issues with mapping memory into secondary processes
EAL: Probing VFIO support...
EAL: WARNING: Address Space Layout Randomization (ASLR) is enabled in the kernel.
EAL:    This may cause issues with mapping memory into secondary processes
EAL: Probing VFIO support...
EAL: WARNING: Address Space Layout Randomization (ASLR) is enabled in the kernel.
EAL:    This may cause issues with mapping memory into secondary processes
EAL: Probing VFIO support...
EAL: WARNING: Address Space Layout Randomization (ASLR) is enabled in the kernel.
EAL:    This may cause issues with mapping memory into secondary processes
EAL: PCI device 0000:01:00.0 on NUMA socket 0
EAL:   probe driver: 8086:10fb rte_ixgbe_pmd
EAL: PCI device 0000:01:00.1 on NUMA socket 0
EAL:   probe driver: 8086:10fb rte_ixgbe_pmd
lcore: 2, port: 0, queue: 2
create mbuf pool on socket 0
create ring:arp_ring_p0_q0 success, 2047 ring entries are now free!
create ring:arp_ring_p0_q1 success, 2047 ring entries are now free!
create ring:arp_ring_p0_q2 success, 2047 ring entries are now free!
create ring:arp_ring_p0_q3 success, 2047 ring entries are now free!
create ring:arp_ring_p0_q4 success, 2047 ring entries are now free!
create ring:arp_ring_p0_q5 success, 2047 ring entries are now free!
create ring:arp_ring_p0_q6 success, 2047 ring entries are now free!
create ring:arp_ring_p0_q7 success, 2047 ring entries are now free!
Port 0 MAC: 90 e2 ba 93 26 0e
RX checksum offload supported
TX ip checksum offload supported
TX TCP&UDP checksum offload supported
TSO is disabled
port[0]: rss table size: 128
EAL: PCI device 0000:01:00.0 on NUMA socket 0
link_elf_lookup_symbol: missing symbol hash table
link_elf_lookup_symbol: missing symbol hash table
EAL:   probe driver: 8086:10fb rte_ixgbe_pmd
EAL: PCI device 0000:01:00.1 on NUMA socket 0
EAL:   probe driver: 8086:10fb rte_ixgbe_pmd
netisr_init: forcing maxthreads from 1 to 0
Timecounters tick every 10.000 msec
lcore: 1, port: 0, queue: 1
create mbuf pool on socket 0
create ring:arp_ring_p0_q0 success, 2047 ring entries are now free!
create ring:arp_ring_p0_q1 success, 2047 ring entries are now free!
create ring:arp_ring_p0_q2 success, 2047 ring entries are now free!
create ring:arp_ring_p0_q3 success, 2047 ring entries are now free!
create ring:arp_ring_p0_q4 success, 2047 ring entries are now free!
create ring:arp_ring_p0_q5 success, 2047 ring entries are now free!
create ring:arp_ring_p0_q6 success, 2047 ring entries are now free!
create ring:arp_ring_p0_q7 success, 2047 ring entries are now free!
Port 0 MAC: 90 e2 ba 93 26 0e
RX checksum offload supported
TX ip checksum offload supported
TX TCP&UDP checksum offload supported
TSO is disabled
port[0]: rss table size: 128
link_elf_lookup_symbol: missing symbol hash table
link_elf_lookup_symbol: missing symbol hash table
netisr_init: forcing maxthreads from 1 to 0
Timecounters tick every 10.000 msec
Timecounter "ff_clock" frequency 100 Hz quality 1
f-stack-0: Ethernet address: 90:e2:ba:93:26:0e
Timecounter "ff_clock" frequency 100 Hz quality 1
f-stack-0: Ethernet address: 90:e2:ba:93:26:0e
EAL: PCI device 0000:01:00.0 on NUMA socket 0
EAL:   probe driver: 8086:10fb rte_ixgbe_pmd
EAL: PCI device 0000:01:00.1 on NUMA socket 0
EAL:   probe driver: 8086:10fb rte_ixgbe_pmd
lcore: 5, port: 0, queue: 5
create mbuf pool on socket 0
create ring:arp_ring_p0_q0 success, 2047 ring entries are now free!
create ring:arp_ring_p0_q1 success, 2047 ring entries are now free!
create ring:arp_ring_p0_q2 success, 2047 ring entries are now free!
create ring:arp_ring_p0_q3 success, 2047 ring entries are now free!
create ring:arp_ring_p0_q4 success, 2047 ring entries are now free!
create ring:arp_ring_p0_q5 success, 2047 ring entries are now free!
create ring:arp_ring_p0_q6 success, 2047 ring entries are now free!
create ring:arp_ring_p0_q7 success, 2047 ring entries are now free!
Port 0 MAC: 90 e2 ba 93 26 0e
RX checksum offload supported
TX ip checksum offload supported
TX TCP&UDP checksum offload supported
TSO is disabled
port[0]: rss table size: 128
link_elf_lookup_symbol: missing symbol hash table
link_elf_lookup_symbol: missing symbol hash table
netisr_init: forcing maxthreads from 1 to 0
Timecounters tick every 10.000 msec
Timecounter "ff_clock" frequency 100 Hz quality 1
f-stack-0: Ethernet address: 90:e2:ba:93:26:0e
EAL: PCI device 0000:01:00.0 on NUMA socket 0
EAL: PCI device 0000:01:00.0 on NUMA socket 0
EAL:   probe driver: 8086:10fb rte_ixgbe_pmd
EAL:   probe driver: 8086:10fb rte_ixgbe_pmd
EAL: PCI device 0000:01:00.1 on NUMA socket 0
EAL: PCI device 0000:01:00.1 on NUMA socket 0
EAL:   probe driver: 8086:10fb rte_ixgbe_pmd
EAL:   probe driver: 8086:10fb rte_ixgbe_pmd
lcore: 6, port: 0, queue: 6
lcore: 7, port: 0, queue: 7
create mbuf pool on socket 0
create mbuf pool on socket 0
create ring:arp_ring_p0_q0 success, 2047 ring entries are now free!
create ring:arp_ring_p0_q0 success, 2047 ring entries are now free!
create ring:arp_ring_p0_q1 success, 2047 ring entries are now free!
create ring:arp_ring_p0_q1 success, 2047 ring entries are now free!
create ring:arp_ring_p0_q2 success, 2047 ring entries are now free!
create ring:arp_ring_p0_q2 success, 2047 ring entries are now free!
create ring:arp_ring_p0_q3 success, 2047 ring entries are now free!
create ring:arp_ring_p0_q3 success, 2047 ring entries are now free!
create ring:arp_ring_p0_q4 success, 2047 ring entries are now free!
create ring:arp_ring_p0_q4 success, 2047 ring entries are now free!
create ring:arp_ring_p0_q5 success, 2047 ring entries are now free!
create ring:arp_ring_p0_q6 success, 2047 ring entries are now free!
create ring:arp_ring_p0_q5 success, 2047 ring entries are now free!
create ring:arp_ring_p0_q7 success, 2047 ring entries are now free!
create ring:arp_ring_p0_q6 success, 2047 ring entries are now free!
create ring:arp_ring_p0_q7 success, 2047 ring entries are now free!
Port 0 MAC: 90 e2 ba 93 26 0e
Port 0 MAC: 90 e2 ba 93 26 0e
RX checksum offload supported
TX ip checksum offload supported
TX TCP&UDP checksum offload supported
TSO is disabled
port[0]: rss table size: 128
RX checksum offload supported
TX ip checksum offload supported
TX TCP&UDP checksum offload supported
TSO is disabled
port[0]: rss table size: 128
link_elf_lookup_symbol: missing symbol hash table
link_elf_lookup_symbol: missing symbol hash table
link_elf_lookup_symbol: missing symbol hash table
link_elf_lookup_symbol: missing symbol hash table
netisr_init: forcing maxthreads from 1 to 0
netisr_init: forcing maxthreads from 1 to 0
Timecounters tick every 10.000 msec
Timecounters tick every 10.000 msec
EAL: PCI device 0000:01:00.0 on NUMA socket 0
EAL: PCI device 0000:01:00.0 on NUMA socket 0
EAL:   probe driver: 8086:10fb rte_ixgbe_pmd
EAL: PCI device 0000:01:00.1 on NUMA socket 0
EAL:   probe driver: 8086:10fb rte_ixgbe_pmd
lcore: 4, port: 0, queue: 4
create mbuf pool on socket 0
create ring:arp_ring_p0_q0 success, 2047 ring entries are now free!
create ring:arp_ring_p0_q1 success, 2047 ring entries are now free!
create ring:arp_ring_p0_q2 success, 2047 ring entries are now free!
create ring:arp_ring_p0_q3 success, 2047 ring entries are now free!
create ring:arp_ring_p0_q4 success, 2047 ring entries are now free!
create ring:arp_ring_p0_q5 success, 2047 ring entries are now free!
create ring:arp_ring_p0_q6 success, 2047 ring entries are now free!
create ring:arp_ring_p0_q7 success, 2047 ring entries are now free!
Port 0 MAC: 90 e2 ba 93 26 0e
RX checksum offload supported
TX ip checksum offload supported
TX TCP&UDP checksum offload supported
TSO is disabled
port[0]: rss table size: 128
Timecounter "ff_clock" frequency 100 Hz quality 1
f-stack-0: Ethernet address: 90:e2:ba:93:26:0e
link_elf_lookup_symbol: missing symbol hash table
link_elf_lookup_symbol: missing symbol hash table
netisr_init: forcing maxthreads from 1 to 0
Timecounters tick every 10.000 msec
Timecounter "ff_clock" frequency 100 Hz quality 1
EAL:   probe driver: 8086:10fb rte_ixgbe_pmd
f-stack-0: Ethernet address: 90:e2:ba:93:26:0e
EAL: PCI device 0000:01:00.1 on NUMA socket 0
Timecounter "ff_clock" frequency 100 Hz quality 1
f-stack-0: Ethernet address: 90:e2:ba:93:26:0e
EAL:   probe driver: 8086:10fb rte_ixgbe_pmd
lcore: 3, port: 0, queue: 3
create mbuf pool on socket 0
create ring:arp_ring_p0_q0 success, 2047 ring entries are now free!
create ring:arp_ring_p0_q1 success, 2047 ring entries are now free!
create ring:arp_ring_p0_q2 success, 2047 ring entries are now free!
create ring:arp_ring_p0_q3 success, 2047 ring entries are now free!
create ring:arp_ring_p0_q4 success, 2047 ring entries are now free!
create ring:arp_ring_p0_q5 success, 2047 ring entries are now free!
create ring:arp_ring_p0_q6 success, 2047 ring entries are now free!
create ring:arp_ring_p0_q7 success, 2047 ring entries are now free!
Port 0 MAC: 90 e2 ba 93 26 0e
RX checksum offload supported
TX ip checksum offload supported
TX TCP&UDP checksum offload supported
TSO is disabled
port[0]: rss table size: 128
link_elf_lookup_symbol: missing symbol hash table
link_elf_lookup_symbol: missing symbol hash table
netisr_init: forcing maxthreads from 1 to 0
Timecounters tick every 10.000 msec
Timecounter "ff_clock" frequency 100 Hz quality 1
f-stack-0: Ethernet address: 90:e2:ba:93:26:0e

</pre>

**Comment by vincentmli** [comment]
for reference, the working config:

/usr/local/nginx_fstack/conf/f-stack.conf
<pre>
[dpdk]
## Hexadecimal bitmask of cores to run on.
lcore_mask=ff
channel=4
promiscuous=1
####set numa off
numa_on=0
## TCP segment offload, default: disabled.
tso=0
## HW vlan strip, default: enabled.
vlan_strip=1

# enabled port list
#
# EBNF grammar:
#
#    exp      ::= num_list {"," num_list}
#    num_list ::= <num> | <range>
#    range    ::= <num>"-"<num>
#    num      ::= '0' | '1' | '2' | '3' | '4' | '5' | '6' | '7' | '8' | '9'
#
# examples
#    1-3       ports 1,2,3 are enabled
#    1-3,4,7   ports 1,2,3,4,7 are enabled
port_list=0

## Port config section
## According to dpdk.nb_ports: port0, port1...
[port0]
addr=10.8.8.2
netmask=255.255.0.0
broadcast=10.8.255.255
gateway=10.8.8.8
# lcore list used to handle this port
# the format is same as port_list
####use 8 lcores
lcore_list= 0-7 

## Packet capture path, this will hurt performance
pcap=./a.pcap

## Kni config: if enabled and method=reject,
## all packets that do not belong to the following tcp_port and udp_port
## will transmit to kernel; if method=accept, all packets that belong to
## the following tcp_port and udp_port will transmit to kernel.
#[kni]
#enable=1
#method=reject
#tcp_port=80,443
#udp_port=53
</pre>

/usr/local/nginx_fstack/conf/nginx.conf
<pre>
# root account is necessary.
user  root;
daemon off;

# should be equal to the lcore count of `dpdk.lcore_mask` in f-stack.conf.
worker_processes  8; 

error_log  logs/error.log info;
#error_log  logs/error.log  notice;
#error_log  logs/error.log  info;

#pid        logs/nginx.pid;

# path of f-stack configuration file, default: $NGX_PREFIX/conf/f-stack.conf.
fstack_conf f-stack.conf;

events {
    worker_connections  102400;
    use kqueue;
}

</pre>

**Comment by whl739** [comment]
I saw this in your startup output:
> EAL: WARNING: Address Space Layout Randomization (ASLR) is enabled in the kernel.
EAL:    This may cause issues with mapping memory into secondary processes

and you should close ASLR.
`echo 0 > /proc/sys/kernel/randomize_va_space`.

**Comment by vincentmli** [comment]
thanks, yep I will close the ASLR
