### ISSUE TITLE
No ARP response for first try.

### ISSUE THREAD

**Issue by beacer** [F-Stack/f-stack#111]
I found f-stack may not response ARP, and easy to reproduce.

### Version and Test Environment

* F-stack: commit 8c317b22318df63736f829347b5022eef1bcd9f1
* Config: 16 cores are used.
```
# nginx.conf
worker_processes  16;
```
```
# f-stack.conf
[dpdk]
## Hexadecimal bitmask of cores to run on.
lcore_mask=ffff
... ...
[port0]
addr=192.168.204.51
netmask=255.255.255.0
broadcast=192.168.204.255
gateway=192.168.204.1
```
* F-stack IP: 192.168.204.51
* Host IP: 192.168.204.56

### Steps to reproduce

1. Make sure Host has no f-stack's ARP entry, and `ping` f-stack. It may takes 1s for first ICMP response. If it's not happen, just remove neigh entry and ping again.

```
host $ ip neigh del 192.168.204.51 dev eth0
host $ ping 192.168.204.51
PING 192.168.204.51 (192.168.204.51) 56(84) bytes of data.
64 bytes from 192.168.204.51: icmp_seq=1 ttl=64 time=1001 ms
64 bytes from 192.168.204.51: icmp_seq=2 ttl=64 time=2.22 ms
64 bytes from 192.168.204.51: icmp_seq=3 ttl=64 time=0.141 ms
```
2. Capture on host shows the first ARP request has no response.

```
host $ tcpdump -i eth0 -nn host 192.168.204.51
tcpdump: verbose output suppressed, use -v or -vv for full protocol decode
listening on eth0, link-type EN10MB (Ethernet), capture size 65535 bytes
13:53:14.818200 ARP, Request who-has 192.168.204.51 tell 192.168.204.56, length 28
13:53:15.819532 ARP, Request who-has 192.168.204.51 tell 192.168.204.56, length 28
13:53:15.819627 ARP, Reply 192.168.204.51 is-at 24:6e:96:3c:a4:3a, length 46
13:53:15.819641 IP 192.168.204.56 > 192.168.204.51: ICMP echo request, id 52240, seq 1, length 64
13:53:15.819644 IP 192.168.204.56 > 192.168.204.51: ICMP echo request, id 52240, seq 2, length 64
13:53:15.819755 IP 192.168.204.51 > 192.168.204.56: ICMP echo reply, id 52240, seq 1, length 64
13:53:15.819773 IP 192.168.204.51 > 192.168.204.56: ICMP echo reply, id 52240, seq 2, length 64
13:53:16.818907 IP 192.168.204.56 > 192.168.204.51: ICMP echo request, id 52240, seq 3, length 64
13:53:16.819037 IP 192.168.204.51 > 192.168.204.56: ICMP echo reply, id 52240, seq 3, length 64
```

**Comment by whl739** [comment]
Enable the packet capture in config.ini, and see what it shows.
```
[port0]
pcap=./a.pcap
```

**Comment by beacer** [comment]
From the `./a.pcap`, it seems the packets from f-stack to host has the wrong destination MAC, all packets send to it's own MAC address `24:6e:96:3c:a4:3a` :)

```
14:39:48.652589 24:6e:96:3c:45:f0 (oui Unknown) > 24:6e:96:3c:a4:3a (oui Unknown), ethertype ARP (0x0806), length 60: Request who-has 192.168.204.51 tell 192.168.204.56, length 46
14:39:49.643115 24:6e:96:3c:45:f0 (oui Unknown) > 24:6e:96:3c:a4:3a (oui Unknown), ethertype IPv4 (0x0800), length 98: 192.168.204.56 > 192.168.204.51: ICMP echo request, id 2869, seq 7, length 64
14:39:49.643115 24:6e:96:3c:a4:3a (oui Unknown) > 24:6e:96:3c:a4:3a (oui Unknown), ethertype IPv4 (0x0800), length 98: 192.168.204.51 > 192.168.204.56: ICMP echo reply, id 2869, seq 7, length 64
14:39:49.652592 24:6e:96:3c:45:f0 (oui Unknown) > 24:6e:96:3c:a4:3a (oui Unknown), ethertype ARP (0x0806), length 60: Request who-has 192.168.204.51 tell 192.168.204.56, length 46
14:39:49.658034 24:6e:96:3c:a4:3a (oui Unknown) > 24:6e:96:3c:a4:3a (oui Unknown), ethertype ARP (0x0806), length 42: Reply 192.168.204.51 is-at 24:6e:96:3c:a4:3a (oui Unknown), length 28
14:39:49.658272 24:6e:96:3c:a4:3a (oui Unknown) > 24:6e:96:3c:a4:3a (oui Unknown), ethertype ARP (0x0806), length 42: Reply 192.168.204.51 is-at 24:6e:96:3c:a4:3a (oui Unknown), length 28
14:39:50.643127 24:6e:96:3c:45:f0 (oui Unknown) > 24:6e:96:3c:a4:3a (oui Unknown), ethertype IPv4 (0x0800), length 98: 192.168.204.56 > 192.168.204.51: ICMP echo request, id 2869, seq 8, length 64
14:39:50.643127 24:6e:96:3c:a4:3a (oui Unknown) > 24:6e:96:3c:a4:3a (oui Unknown), ethertype IPv4 (0x0800), length 98: 192.168.204.51 > 192.168.204.56: ICMP echo reply, id 2869, seq 8, length 64
14:39:50.652594 24:6e:96:3c:45:f0 (oui Unknown) > 24:6e:96:3c:a4:3a (oui Unknown), ethertype ARP (0x0806), length 60: Request who-has 192.168.204.51 tell 192.168.204.56, length 46
14:39:51.643139 24:6e:96:3c:45:f0 (oui Unknown) > 24:6e:96:3c:a4:3a (oui Unknown), ethertype IPv4 (0x0800), length 98: 192.168.204.56 > 192.168.204.51: ICMP echo request, id 2869, seq 9, length 64
14:39:51.643139 24:6e:96:3c:a4:3a (oui Unknown) > 24:6e:96:3c:a4:3a (oui Unknown), ethertype IPv4 (0x0800), length 98: 192.168.204.51 > 192.168.204.56: ICMP echo reply, id 2869, seq 9, length 64
```

**Comment by mscbg** [comment]
This may happen because of this, may be help:
f-stack use "rte_pktmbuf_clone" copy arp mbuf to every core, and this function just copy pointer to pkt.data. when pkt is arp request, and one core just use this pkt to make an arp response mbuf, copied mbuf will alse be changed on other cores.

**Comment by whl739** [comment]
It sounds quite reasonable. I've always thought that there's a problem here.

**Comment by whl739** [comment]
After i debuged the program, it is exactly the problem what @mscbg said.
#53 #112 are same with this issue.
I will fix it later.

**Comment by beacer** [comment]
@whl739 Ok, so for #112, just some lcore has the wrong dst MAC , right ? So not all curl fails.

**Comment by whl739** [comment]
Yes.
